Code,Name,Agreement,Auditor,Change,Debt,Delist,GEM,Halt,Insurance,Litigation,Loan,Potential Issue,Report,Resignation,Restriction,Restructure,Resumption,RTO,Share,Transaction,Long-stop,Offshore,Special Dividend,Specific Mandate,Fluctuation,Voting,IPO
00995,Anhui Expressway Co. Ltd. - H Shares,Y,N,Y,Y,N,N,N,N,N,N,Y,Y,Y,N,N,N,N,Y,Y,N,N,N,N,N,Y,N
00996,Carnival Group International Holdings Ltd.,Y,N,Y,Y,N,N,N,N,N,N,Y,Y,Y,N,N,Y,N,Y,Y,N,N,N,N,Y,N,N
00997,Chinlink International Holdings Ltd.,Y,N,Y,Y,N,N,Y,N,N,Y,Y,Y,Y,N,N,Y,N,Y,Y,Y,N,N,N,Y,N,N
00998,China CITIC Bank Corporation Ltd. - H Shares,Y,N,Y,Y,N,N,Y,N,N,N,N,Y,Y,N,N,Y,N,N,Y,N,Y,N,N,N,N,N
00999,I.T Ltd.,N,N,N,Y,N,N,N,N,N,N,Y,Y,Y,N,N,N,N,N,Y,N,N,N,N,N,N,N
01000,Beijing Media Corporation Ltd. - H Shares,N,N,Y,N,N,N,N,N,N,N,N,Y,N,N,N,N,N,N,Y,N,N,N,N,N,N,N
01001,Hong Kong Shanghai Alliance Holdings Ltd.,Y,N,Y,N,N,N,Y,N,N,N,Y,Y,N,N,Y,Y,N,Y,Y,N,N,N,N,N,N,N
01002,V.S. International Group Ltd.,Y,N,N,N,N,N,N,N,N,N,N,Y,Y,N,Y,N,N,Y,Y,N,N,N,N,Y,N,N
01003,Huanxi Media Group Ltd.,Y,N,Y,N,N,N,Y,N,N,Y,Y,Y,Y,N,Y,Y,N,Y,Y,N,N,N,N,Y,N,N
01004,China Smarter Energy Group Holdings Ltd.,Y,N,Y,Y,N,N,Y,N,N,N,Y,Y,Y,N,N,Y,N,Y,Y,N,N,N,N,Y,N,N
01005,Matrix Holdings Ltd.,Y,N,Y,N,N,N,N,N,N,N,Y,Y,N,N,N,N,N,N,Y,N,N,Y,N,Y,N,N
01006,Changshouhua Food Co. Ltd.,Y,N,Y,N,N,N,N,N,N,N,N,Y,N,N,N,N,N,N,Y,N,N,N,N,N,N,N
01007,Daqing Dairy Holdings Ltd.,Y,Y,Y,N,Y,N,N,N,N,N,Y,Y,Y,N,N,N,N,N,N,N,N,N,N,N,N,N
01008,Brilliant Circle Holdings International Ltd.,N,N,Y,N,N,N,Y,N,N,N,Y,Y,N,N,N,Y,N,Y,Y,N,N,Y,N,N,N,N
01009,International Entertainment Corporation,N,N,Y,N,N,N,Y,N,N,N,Y,Y,N,N,Y,Y,N,N,Y,N,N,N,N,Y,N,N
01010,PacRay International Holdings Ltd.,N,N,Y,N,N,N,Y,N,N,N,Y,Y,Y,N,N,Y,N,Y,Y,N,N,N,N,N,N,N
01011,China NT Pharma Group Co. Ltd.,N,Y,Y,Y,N,N,Y,N,N,N,Y,Y,Y,N,Y,Y,N,Y,Y,N,N,N,N,Y,N,N
01013,Wai Chun Group Holdings Ltd.,N,N,Y,N,N,N,Y,N,N,N,Y,Y,Y,N,N,Y,N,Y,Y,N,N,N,N,Y,N,N
01019,Convoy Global Holdings Ltd.,Y,N,Y,Y,N,N,Y,N,N,Y,Y,Y,Y,N,Y,Y,N,Y,Y,N,N,N,N,Y,N,N
01020,Sinoref Holdings Ltd.,Y,N,Y,N,N,N,Y,N,N,Y,Y,Y,Y,N,N,Y,N,Y,Y,N,N,N,N,Y,N,N
01021,Midas Holdings Ltd.,Y,N,Y,N,N,N,Y,N,N,N,N,Y,Y,N,N,Y,N,N,N,N,Y,N,N,N,N,N
01022,Feiyu Technology International Co. Ltd.,Y,N,Y,N,N,N,N,N,N,N,Y,Y,N,N,N,N,N,Y,Y,N,N,N,N,Y,N,Y
01023,Sitoy Group Holdings Ltd.,N,N,Y,N,N,N,N,N,N,N,N,Y,N,N,N,N,N,N,Y,N,N,N,N,N,N,N
01026,Universal Technologies Holdings Ltd.,Y,N,Y,N,N,N,Y,N,N,N,Y,Y,Y,N,N,Y,N,N,Y,N,N,N,N,N,N,N
01027,China Jicheng Holdings Ltd.,Y,N,Y,N,N,N,Y,N,N,N,Y,Y,N,N,N,Y,N,Y,Y,N,N,N,N,Y,N,Y
01028,C.banner International Holdings Ltd.,N,N,Y,Y,N,N,Y,N,N,N,N,Y,Y,N,N,Y,N,N,Y,N,N,Y,N,N,N,N
01029,IRC Ltd.,Y,N,Y,Y,N,N,Y,N,N,N,Y,Y,N,N,Y,Y,N,Y,Y,N,N,N,N,Y,N,Y
01030,Future Land Development Holdings Ltd.,N,N,Y,Y,N,N,Y,N,N,Y,N,Y,Y,Y,Y,Y,N,N,Y,N,Y,N,N,N,N,N
01031,Kingston Financial Group Ltd.,Y,N,Y,N,N,N,Y,N,N,N,N,Y,N,N,N,Y,N,Y,Y,N,N,N,N,Y,N,N
01033,Sinopec Oilfield Service Corporation - H Shares,Y,Y,Y,N,Y,N,N,N,N,N,Y,Y,Y,N,Y,Y,N,Y,Y,N,Y,N,N,Y,N,N
01035,BBI Life Sciences Corporation,Y,N,N,N,N,N,N,N,N,N,Y,Y,Y,N,N,N,N,N,Y,N,N,N,N,N,N,Y
01036,Vanke Property (Overseas) Ltd.,Y,N,Y,N,N,N,N,N,N,N,N,Y,N,N,N,N,N,Y,Y,N,N,N,N,Y,N,N
01037,Maxnerva Technology Services Ltd.,N,N,Y,N,N,N,Y,N,N,N,Y,Y,Y,N,Y,Y,N,Y,Y,N,N,Y,N,Y,N,N
01038,Cheung Kong Infrastructure Holdings Ltd.,Y,N,Y,Y,N,N,Y,N,N,N,N,Y,N,N,N,Y,N,Y,Y,N,N,N,N,N,N,N
01039,Fortunet e-Commerce Group Ltd.,Y,N,Y,Y,N,N,Y,N,N,Y,Y,Y,Y,N,Y,Y,N,Y,Y,N,N,N,N,N,N,N
01041,China New Energy Power Group Ltd.,Y,N,Y,N,N,N,N,N,N,Y,Y,Y,Y,N,N,N,N,N,Y,N,N,N,N,Y,N,N
01043,Coslight Technology International Group Ltd.,N,N,Y,N,N,N,N,N,N,N,N,Y,N,N,N,N,N,N,Y,N,N,N,N,N,N,N
01044,Hengan International Group Co. Ltd.,N,N,Y,Y,N,N,N,N,N,N,N,Y,N,N,N,N,N,N,Y,N,N,N,N,N,N,N
01045,APT Satellite Holdings Ltd.,N,N,Y,Y,N,N,N,N,N,N,Y,Y,N,N,N,N,N,Y,Y,N,N,N,N,N,N,N
01046,Universe International Financial Holdings Ltd.,Y,N,Y,Y,N,N,Y,N,N,Y,Y,Y,N,N,Y,Y,N,Y,Y,Y,N,N,N,Y,N,N
01047,Ngai Hing Hong Co. Ltd.,N,N,Y,N,N,N,N,N,N,N,Y,Y,N,N,N,N,N,N,N,N,N,N,N,Y,N,N
01048,Novo Group Ltd.,N,N,Y,N,N,N,Y,N,Y,N,Y,Y,Y,N,Y,Y,N,Y,Y,N,Y,N,N,Y,N,N
01049,Celestial Asia Securities Holdings Ltd.,Y,N,Y,N,N,N,Y,N,N,N,N,Y,Y,N,N,Y,N,Y,Y,N,N,N,N,Y,N,Y
01050,Karrie International Holdings Ltd.,Y,Y,Y,N,N,N,N,N,N,N,Y,Y,Y,N,N,N,N,N,Y,N,N,N,N,N,N,N
01051,G-Resources Group Ltd.,N,N,Y,N,N,N,N,N,N,N,Y,Y,Y,N,N,Y,N,Y,Y,N,N,N,N,N,N,N
01052,Yuexiu Transport Infrastructure Ltd.,N,N,Y,Y,N,N,N,N,N,N,Y,Y,N,N,N,N,N,N,Y,N,N,N,N,N,N,N
01053,Chongqing Iron & Steel Co. Ltd. - H Shares,Y,N,Y,N,N,N,Y,N,N,N,Y,Y,Y,N,Y,Y,N,Y,Y,N,N,N,N,N,N,N
01055,China Southern Airlines Co. Ltd. - H Shares,Y,Y,Y,Y,N,N,N,N,N,N,Y,Y,Y,N,Y,N,N,N,Y,N,Y,N,N,N,N,N
01057,Zhejiang Shibao Co. Ltd. - H Shares,N,N,Y,Y,N,N,Y,N,N,N,Y,Y,N,N,N,Y,N,N,Y,N,Y,N,N,Y,N,N
01058,Guangdong Tannery Ltd.,Y,N,Y,N,N,N,N,N,N,N,Y,Y,Y,N,N,N,N,N,N,N,N,N,N,Y,N,N
01059,Kantone Holdings Ltd.,Y,N,Y,N,N,N,N,N,N,N,Y,Y,N,N,N,N,N,Y,N,N,N,N,N,Y,N,N
01060,Alibaba Pictures Group Ltd.,Y,Y,Y,Y,N,N,Y,N,N,N,Y,Y,N,N,Y,Y,N,Y,Y,N,N,N,N,Y,N,N
01061,Essex Bio-Technology Ltd.,N,N,N,N,N,N,N,N,N,Y,N,Y,N,N,N,N,N,N,N,N,N,N,N,N,N,N
01062,China Development Bank International Investment Ltd.,Y,N,Y,Y,N,N,Y,N,N,Y,Y,Y,Y,N,N,Y,N,N,Y,N,N,N,N,N,N,N
01063,Suncorp Technologies Ltd.,Y,N,Y,Y,N,N,Y,N,N,Y,Y,Y,Y,N,N,Y,N,Y,Y,N,N,N,N,Y,N,N
01064,Zhong Hua International Holdings Ltd.,N,N,N,N,N,N,N,N,Y,N,N,Y,N,N,N,N,N,Y,N,N,N,N,N,Y,N,N
01065,Tianjin Capital Environmental Protection Group Co. Ltd.-H Sh,Y,N,N,Y,N,N,N,N,N,N,N,Y,N,N,N,N,N,N,Y,N,N,N,N,N,N,N
01066,Shandong Weigao Group Medical Polymer Co. Ltd. - H Shares,N,N,Y,N,N,N,N,N,N,N,Y,Y,Y,N,N,N,N,N,Y,N,N,N,N,N,N,N
01068,China Yurun Food Group Ltd.,N,N,Y,Y,N,N,Y,N,N,N,Y,Y,Y,N,N,Y,N,N,Y,N,N,N,N,N,N,N
01069,China Agroforestry Low-Carbon Holdings Ltd.,Y,Y,Y,Y,N,N,Y,N,N,N,Y,Y,Y,N,N,Y,N,Y,Y,N,N,N,N,N,N,N
01070,TCL Multimedia Technology Holdings Ltd.,Y,N,Y,N,N,N,Y,N,N,Y,Y,Y,Y,N,Y,Y,N,Y,Y,N,N,N,Y,N,N,N
01071,Huadian Power International Corporation Ltd. - H Shares,Y,N,Y,N,N,N,Y,N,N,N,Y,Y,Y,N,Y,Y,N,Y,Y,N,Y,N,N,N,N,N
01072,Dongfang Electric Corporation Ltd. - H Shares,Y,N,Y,Y,N,N,N,N,N,N,Y,Y,Y,N,N,N,N,N,Y,N,Y,N,N,N,N,N
01073,China Agrotech Holdings Ltd.,Y,N,Y,Y,Y,N,Y,N,Y,N,Y,Y,Y,N,Y,Y,N,N,Y,N,N,N,N,N,N,N
01075,Capinfo Co. Ltd. - H Shares,N,N,Y,N,N,N,N,N,N,N,Y,Y,Y,N,N,Y,N,N,Y,N,N,N,N,Y,N,N
01076,Imperial Pacific International Holdings Ltd.,Y,N,Y,Y,N,N,Y,N,N,Y,Y,Y,N,N,N,Y,N,Y,Y,N,N,N,N,Y,N,N
01079,Pine Technology Holdings Ltd.,N,Y,Y,N,N,N,N,N,N,N,Y,Y,N,N,N,N,N,N,Y,N,N,N,N,Y,N,N
01080,Shengli Oil & Gas Pipe Holdings Ltd.,N,Y,Y,N,N,N,N,N,N,N,Y,Y,Y,N,N,N,N,Y,Y,N,N,N,N,Y,N,N
01082,Hong Kong Education (Int'l) Investments Ltd.,Y,Y,Y,Y,N,N,Y,N,N,Y,Y,Y,N,N,Y,Y,N,Y,Y,N,N,N,N,Y,N,N
01083,Towngas China Co. Ltd.,N,N,N,N,N,N,N,N,N,N,N,Y,Y,N,N,N,N,N,Y,N,N,N,N,N,N,N
01085,Hengxin Technology Ltd.,N,N,Y,N,Y,N,Y,N,N,N,N,Y,Y,N,Y,Y,N,Y,Y,N,Y,N,N,Y,N,N
01086,Goodbaby International Holdings Ltd.,N,N,Y,N,N,N,Y,N,N,N,Y,Y,Y,N,N,Y,N,N,Y,N,N,N,N,N,N,N
01087,InvesTech Holdings Ltd.,Y,N,Y,N,N,N,Y,N,N,N,Y,Y,Y,N,Y,Y,N,N,Y,N,N,N,N,Y,N,N
01088,China Shenhua Energy Co. Ltd. - H Shares,N,N,Y,Y,N,N,N,N,N,N,N,Y,Y,N,N,N,N,N,Y,N,Y,N,N,N,N,N
01089,Leyou Technologies Holdings Ltd.,Y,N,Y,Y,N,N,N,N,N,N,Y,Y,N,N,N,N,N,Y,Y,N,N,N,N,N,N,N
01090,Da Ming International Holdings Ltd.,Y,N,N,N,N,N,N,N,N,N,Y,Y,Y,N,N,N,N,Y,Y,N,N,N,N,Y,N,N
01091,CITIC Dameng Holdings Ltd.,N,N,Y,Y,N,N,N,N,Y,N,Y,Y,Y,N,Y,N,N,Y,Y,N,N,N,N,Y,N,N
01093,CSPC Pharmaceutical Group Ltd.,N,N,Y,N,N,N,Y,N,N,N,Y,Y,N,N,Y,Y,N,Y,Y,N,N,N,N,N,N,N
01094,China Public Procurement Ltd.,Y,N,Y,Y,N,N,Y,N,N,Y,Y,Y,Y,N,N,Y,N,Y,Y,N,N,N,N,Y,N,N
01096,Sino Energy International Holdings Group Ltd.,Y,Y,Y,Y,N,N,Y,N,N,N,Y,Y,Y,N,N,Y,N,Y,Y,N,N,N,N,Y,N,N
01097,i-CABLE Communications Ltd.,N,N,Y,N,N,N,N,N,N,N,N,Y,N,N,N,N,N,Y,Y,N,N,N,N,Y,N,N
01098,Road King Infrastructure Ltd.,Y,N,Y,Y,N,N,N,N,N,Y,Y,Y,Y,N,N,N,N,N,Y,N,Y,N,N,N,N,N
01099,Sinopharm Group Co. Ltd. - H Shares,N,Y,Y,Y,N,N,N,N,N,N,N,Y,Y,N,Y,N,N,N,Y,N,N,N,N,N,N,N
01100,Mainland Headwear Holdings Ltd.,N,N,Y,N,N,N,N,N,N,N,Y,Y,N,N,N,Y,N,N,Y,N,N,N,N,N,N,N
01101,China Huarong Energy Co. Ltd.,Y,N,Y,Y,N,N,Y,N,Y,N,Y,Y,Y,N,Y,Y,N,Y,Y,Y,Y,N,N,Y,N,N
01102,Enviro Energy International Holdings Ltd.,Y,N,Y,N,N,N,Y,N,N,N,Y,Y,N,N,Y,Y,N,Y,Y,N,N,N,N,Y,N,N
01103,"Shanghai Dasheng Agriculture Finance Technology Co, Ltd-H Sh",Y,N,Y,Y,N,N,Y,N,N,N,Y,Y,Y,N,Y,Y,N,Y,Y,N,N,N,N,Y,N,N
01104,APAC Resources Ltd.,N,N,Y,N,N,N,Y,N,N,Y,Y,Y,Y,N,Y,Y,N,Y,Y,N,Y,N,N,Y,N,N
01105,Sing Tao News Corporation Ltd.,N,N,Y,N,N,N,N,N,N,N,Y,Y,Y,N,N,N,N,N,Y,N,N,N,N,N,N,N
01106,Sino Haijing Holdings Ltd.,Y,N,Y,Y,N,N,Y,N,N,N,Y,Y,Y,N,N,Y,N,Y,Y,N,N,N,N,N,N,N
01107,"Modern Land (China) Co., Ltd.",Y,N,Y,Y,N,N,Y,N,N,Y,N,Y,N,N,N,Y,N,Y,Y,N,N,N,N,N,N,N
01108,Luoyang Glass Co. Ltd. - H Shares,Y,N,Y,N,N,N,Y,N,N,N,Y,Y,Y,N,Y,Y,N,Y,Y,N,Y,N,N,N,N,N
01109,China Resources Land Ltd.,Y,N,Y,Y,N,N,Y,N,N,Y,Y,Y,Y,N,Y,Y,N,Y,Y,N,N,N,N,N,N,Y
01110,Kingworld Medicines Group Ltd.,Y,N,Y,Y,N,N,N,N,N,N,N,Y,N,N,N,N,N,N,Y,N,N,N,N,Y,N,N
01111,Chong Hing Bank Ltd.,N,N,Y,N,N,N,Y,N,N,N,Y,Y,N,N,N,Y,N,Y,Y,N,N,N,N,N,N,N
01112,Biostime International Holdings Ltd.,N,N,Y,Y,N,N,Y,N,N,Y,Y,Y,N,N,N,Y,N,N,Y,N,Y,N,N,Y,N,N
01113,Cheung Kong Property Holdings Ltd.,Y,N,Y,N,N,N,N,N,N,N,N,Y,N,N,N,N,N,N,N,N,N,N,N,N,N,N
01114,Brilliance China Automotive Holdings Ltd.,N,N,Y,N,N,N,N,N,N,N,Y,Y,Y,N,N,N,N,N,Y,N,N,N,N,N,N,N
01115,Tibet Water Resources Ltd.,N,N,Y,Y,N,N,N,N,N,N,Y,Y,Y,N,N,N,N,N,Y,N,N,N,N,N,N,N
01116,Mayer Holdings Ltd.,N,Y,Y,N,Y,N,N,N,Y,N,N,Y,Y,N,N,N,N,N,Y,N,N,N,N,N,N,N
01117,China Modern Dairy Holdings Ltd.,N,N,Y,Y,N,N,N,N,N,N,Y,Y,Y,N,Y,N,N,Y,Y,N,N,N,N,N,N,N
01118,Golik Holdings Ltd.,N,N,Y,N,N,N,N,N,N,N,Y,Y,N,N,Y,N,N,N,Y,N,N,N,N,N,N,N
01120,Arts Optical International Holdings Ltd.,N,N,Y,N,N,N,Y,N,N,N,Y,Y,N,N,Y,Y,N,N,Y,N,N,N,N,N,Y,N
01121,Baofeng Modern International Holdings Co. Ltd.,Y,Y,Y,Y,N,N,N,N,N,N,Y,Y,Y,N,Y,N,N,N,Y,N,N,N,N,N,N,N
01122,Qingling Motors Co. Ltd. - H Shares,N,N,Y,N,N,N,N,N,Y,N,N,Y,Y,N,Y,N,N,N,Y,N,N,N,N,N,N,N
01123,China-Hongkong Photo Products Holdings Ltd.,N,N,Y,N,N,N,N,N,N,N,Y,Y,N,N,N,N,N,N,N,N,N,N,N,N,N,N
01124,Coastal Greenland Ltd.,Y,N,Y,N,N,N,Y,N,N,Y,Y,Y,N,N,Y,Y,N,Y,Y,N,N,N,N,Y,N,N
01125,Lai Fung Holdings Ltd.,Y,N,Y,N,N,N,Y,N,N,Y,Y,Y,N,N,N,Y,N,N,Y,N,N,N,N,N,N,N
01126,Dream International Ltd.,Y,N,Y,N,N,N,N,N,N,N,Y,Y,N,N,N,Y,N,N,Y,N,N,N,N,N,N,N
01127,1010 Printing Group Ltd.,N,N,Y,Y,N,N,N,N,N,N,N,Y,N,N,N,N,N,N,Y,N,N,N,N,N,N,N
01128,"Wynn Macau, Ltd.",N,Y,Y,Y,N,N,N,N,Y,N,N,Y,N,N,N,N,N,N,Y,N,N,Y,N,N,N,N
01129,China Water Industry Group Ltd.,Y,Y,Y,Y,N,N,Y,N,N,N,Y,Y,N,N,Y,Y,N,N,Y,N,N,N,N,N,N,N
01130,China Environmental Resources Group Ltd.,Y,N,Y,N,N,N,N,N,N,Y,Y,Y,N,N,N,Y,N,Y,Y,Y,N,N,N,Y,N,N
01131,Agritrade Resources Ltd.,Y,N,Y,Y,N,N,N,N,N,N,Y,Y,Y,N,Y,Y,N,Y,Y,Y,N,N,N,Y,N,N
01132,Orange Sky Golden Harvest Entertainment (Holdings) Ltd.,N,N,Y,Y,N,N,N,N,N,N,Y,Y,N,N,N,N,N,N,Y,Y,N,N,N,N,N,N
01133,Harbin Electric Co. Ltd. - H Shares,N,N,Y,Y,N,N,N,N,N,N,Y,Y,Y,N,N,N,N,N,Y,N,N,N,N,Y,N,N
01135,Asia Satellite Telecommunications Holdings Ltd.,N,N,Y,N,N,N,Y,N,N,N,Y,Y,Y,N,Y,Y,N,Y,Y,N,N,N,N,N,N,N
01136,TCC International Holdings Ltd.,N,N,Y,N,N,N,Y,N,N,N,Y,Y,N,N,Y,Y,N,Y,Y,N,Y,N,N,N,N,N
01137,Hong Kong Television Network Ltd.,N,N,Y,Y,N,N,Y,N,N,N,N,Y,Y,N,N,Y,N,N,Y,N,Y,N,N,Y,N,N
01138,China Shipping Development Co. Ltd. - H Shares,N,N,Y,Y,N,N,Y,N,N,N,Y,Y,Y,N,Y,Y,N,N,Y,N,Y,N,N,N,N,N
01139,Victory Group Ltd.,N,Y,Y,N,N,N,N,N,N,N,Y,Y,N,N,N,N,N,N,N,N,N,N,N,Y,N,N
01140,OP Financial Investments Ltd.,Y,N,Y,N,N,N,N,N,N,N,N,Y,N,N,N,N,N,Y,Y,N,N,N,N,Y,N,N
01141,Skyway Securities Group Ltd.,Y,Y,Y,N,N,N,Y,N,N,Y,Y,Y,Y,N,Y,Y,N,Y,Y,N,N,N,N,Y,N,N
01142,Siberian Mining Group Co. Ltd.,Y,Y,Y,N,N,N,N,N,Y,Y,Y,Y,Y,N,N,Y,N,Y,Y,N,N,N,N,Y,N,N
01143,China Healthcare Enterprise Group Ltd.,Y,N,Y,N,N,N,Y,N,N,N,Y,Y,N,N,Y,Y,N,Y,Y,N,N,N,N,Y,N,N
01145,Courage Marine Group Ltd.,Y,N,Y,N,N,N,N,N,N,Y,Y,Y,Y,N,N,N,N,Y,Y,N,Y,N,N,N,N,N
01146,China Outfitters Holdings Ltd.,Y,N,Y,N,N,N,N,N,N,N,Y,Y,Y,N,N,N,N,N,Y,N,N,N,N,N,N,N
01148,Xinchen China Power Holdings Ltd.,N,N,Y,N,N,N,Y,N,N,N,Y,Y,Y,N,Y,Y,N,N,Y,N,N,N,N,N,N,N
01149,Anxin-China Holdings Ltd.,Y,Y,Y,N,Y,N,N,N,Y,N,Y,Y,Y,N,Y,Y,N,Y,Y,N,N,N,N,N,N,N
01150,Milan Station Holdings Ltd.,Y,Y,Y,N,N,N,Y,N,N,N,Y,Y,N,N,N,Y,N,Y,Y,N,N,N,N,Y,N,N
01151,Elec & Eltek International Co. Ltd.,N,N,Y,N,N,N,N,N,N,N,Y,Y,Y,N,N,N,N,N,Y,N,Y,N,N,N,N,N
01152,Infinity Financial Group (Holdings) Ltd.,Y,N,Y,Y,N,N,N,N,N,N,Y,Y,Y,N,Y,N,N,Y,Y,N,N,N,N,Y,N,N
01155,Centron Telecom International Holding Ltd.,N,N,Y,N,N,N,N,N,N,Y,Y,Y,Y,N,N,N,N,N,Y,N,N,N,N,N,N,N
01157,"Zoomlion Heavy Industry Science and Technology Co., Ltd-H Sh",Y,N,Y,Y,N,N,Y,N,N,N,Y,Y,Y,N,Y,Y,N,N,Y,N,N,N,N,N,N,N
01159,Jimei International Entertainment Group Ltd.,Y,N,Y,Y,N,N,Y,N,Y,N,Y,Y,Y,N,Y,Y,N,N,Y,N,N,N,N,N,N,N
01160,Grand Investment International Ltd.,N,N,Y,N,N,N,N,N,N,N,Y,Y,Y,N,N,Y,N,N,N,N,N,N,N,Y,N,N
01161,Water Oasis Group Ltd.,N,N,Y,N,N,N,N,N,N,N,Y,Y,N,N,N,N,N,N,N,N,N,N,N,Y,N,N
01163,Dejin Resources Group Co. Ltd.,Y,N,Y,Y,Y,N,Y,N,Y,N,Y,Y,Y,N,N,Y,N,N,N,N,N,N,N,N,N,N
01164,CGN Mining Co. Ltd.,Y,N,Y,Y,N,N,N,N,N,Y,Y,Y,Y,N,N,N,N,N,Y,N,N,N,N,N,N,N
01165,Shunfeng International Clean Energy Ltd.,Y,Y,Y,Y,N,N,Y,N,N,Y,Y,Y,Y,N,Y,Y,N,Y,Y,N,N,N,N,N,N,N
01166,Solartech International Holdings Ltd.,Y,N,Y,N,N,N,N,N,N,N,Y,Y,N,N,Y,N,N,Y,Y,N,N,N,N,Y,N,N
01168,Sinolink Worldwide Holdings Ltd.,Y,N,N,N,N,N,N,N,N,N,Y,Y,Y,N,N,N,N,N,N,N,N,N,N,Y,N,N
01169,"Haier Electronics Group Co., Ltd.",N,N,Y,Y,N,N,Y,N,N,N,N,Y,Y,N,N,Y,N,N,Y,N,N,N,N,Y,N,N
01170,Kingmaker Footwear Holdings Ltd.,N,N,N,N,N,N,Y,N,N,N,Y,Y,N,N,N,Y,N,Y,N,N,N,Y,N,N,N,N
01171,Yanzhou Coal Mining Co. Ltd. - H Shares,Y,N,Y,Y,N,N,Y,N,Y,Y,N,Y,Y,N,Y,Y,N,Y,Y,N,Y,N,N,N,N,Y
01172,Midas International Holdings Ltd.,Y,N,N,Y,N,N,N,N,N,N,Y,Y,N,N,Y,N,N,Y,Y,N,N,N,N,N,N,N
01173,Veeko International Holdings Ltd.,N,N,Y,N,N,N,Y,N,N,N,Y,Y,N,N,N,Y,N,N,N,N,N,N,N,Y,N,N
01174,Pacific Andes International Holdings Ltd.,Y,N,Y,Y,N,N,Y,N,Y,Y,Y,Y,Y,N,Y,Y,N,Y,Y,N,N,N,N,Y,N,N
01175,"Fresh Express Delivery Holdings Group Co., Ltd.",N,N,Y,N,N,N,Y,N,N,N,Y,Y,Y,N,N,Y,N,Y,Y,N,N,N,N,Y,N,N
01176,Zhuguang Holdings Group Co. Ltd.,Y,N,Y,Y,N,N,N,N,N,N,Y,Y,N,N,Y,Y,N,N,Y,Y,N,N,N,N,N,N
01177,Sino Biopharmaceutical Ltd.,N,N,Y,N,N,N,Y,N,N,Y,N,Y,Y,N,Y,Y,N,Y,Y,N,N,N,N,N,N,N
01178,Vitop Group Ltd.,Y,N,Y,N,N,N,Y,N,N,N,Y,Y,Y,N,N,Y,N,Y,Y,N,N,N,N,Y,N,N
01180,Paradise Entertainment Ltd.,Y,N,Y,N,N,N,N,N,N,N,Y,Y,N,N,N,N,N,N,Y,N,N,N,N,Y,N,N
01181,Tang Palace (China) Holdings Ltd.,N,N,Y,N,N,N,N,N,N,N,N,Y,N,N,N,N,N,Y,Y,N,N,N,N,N,N,N
01182,Success Dragon International Holdings Ltd.,Y,N,Y,Y,N,N,Y,N,Y,N,Y,Y,Y,N,N,Y,N,N,Y,N,N,N,N,Y,N,N
01184,S.A.S. Dragon Holdings Ltd.,N,N,Y,N,N,N,N,N,N,N,Y,Y,Y,N,N,N,N,Y,Y,N,N,N,N,N,N,N
01185,China Energine International (Holdings) Ltd.,Y,N,Y,N,N,N,N,N,N,N,Y,Y,N,N,N,N,N,Y,Y,N,N,N,N,N,N,N
01186,China Railway Construction Corporation Ltd. - H Shares,Y,N,Y,Y,N,N,Y,N,N,N,Y,Y,N,N,Y,Y,N,Y,Y,N,Y,N,N,N,N,N
01187,Han Tang International Holdings Ltd.,Y,N,Y,Y,Y,N,Y,N,N,Y,Y,Y,Y,N,N,Y,N,N,N,N,N,N,N,N,N,N
01188,Hybrid Kinetic Group Ltd.,Y,N,N,N,N,N,Y,N,N,N,N,Y,Y,N,Y,Y,N,Y,Y,N,N,N,N,Y,N,N
01189,Rosedale Hotel Holdings Ltd.,Y,N,Y,N,N,N,Y,N,N,Y,Y,Y,N,N,N,Y,N,N,Y,N,N,Y,N,Y,N,N
01190,"Bolina Holding Co., Ltd.",N,N,Y,Y,N,N,N,N,Y,Y,Y,Y,Y,N,N,N,N,N,Y,N,N,N,N,N,N,N
01191,Yueshou Environmental Holdings Ltd.,Y,Y,Y,N,N,N,Y,N,Y,Y,Y,Y,Y,N,Y,Y,N,Y,Y,N,N,N,N,Y,N,N
01192,Titan Petrochemicals Group Ltd.,Y,Y,Y,Y,Y,N,N,N,Y,Y,Y,Y,Y,N,Y,Y,N,Y,N,N,N,N,N,N,N,N
01193,China Resources Gas Group Ltd.,Y,N,Y,N,N,N,N,N,N,Y,Y,Y,N,N,N,N,N,N,Y,N,N,N,N,N,N,N
01194,"China Precious Metal Resources Holdings Co., Ltd.",Y,N,Y,Y,N,N,Y,N,N,Y,Y,Y,Y,N,N,Y,N,Y,Y,N,N,N,Y,N,N,N
01195,Kingwell Group Ltd.,Y,N,Y,Y,N,N,Y,N,N,N,Y,Y,Y,N,N,Y,N,Y,Y,N,N,N,N,Y,N,N
01196,Realord Group Holdings Ltd.,N,N,Y,N,N,N,Y,N,N,Y,Y,Y,N,N,Y,Y,N,Y,Y,N,N,N,N,N,N,N
01197,China Hengshi Foundation Co. Ltd.,Y,N,N,N,N,N,N,N,N,Y,N,Y,N,N,N,N,N,N,Y,N,N,N,N,N,N,Y
01198,Royale Furniture Holdings Ltd.,Y,N,Y,Y,N,N,Y,N,N,Y,Y,Y,Y,N,Y,Y,N,N,Y,N,N,N,N,N,N,N
01199,COSCO Pacific Ltd.,N,N,Y,N,N,N,N,N,N,N,Y,Y,Y,N,Y,Y,N,N,Y,N,N,N,N,N,N,N
01200,Midland Holdings Ltd.,N,N,Y,N,N,N,N,N,N,N,Y,Y,N,N,N,N,N,Y,Y,N,N,N,N,N,N,N
01201,Tesson Holdings Ltd.,Y,Y,Y,Y,Y,N,Y,N,Y,N,Y,Y,Y,N,Y,Y,N,Y,Y,N,N,N,N,N,N,N
01202,Chengdu PUTIAN Telecommunications Cable Co. Ltd. - H Shares,N,Y,Y,N,N,N,N,N,N,N,N,Y,N,N,Y,N,N,N,Y,N,N,N,N,N,N,N
01203,Guangnan (Holdings) Ltd.,Y,N,Y,N,N,N,N,N,N,N,Y,Y,Y,N,N,N,N,N,Y,N,N,N,N,N,N,N
01205,CITIC Resources Holdings Ltd.,Y,N,Y,Y,N,N,N,N,Y,N,Y,Y,Y,N,Y,N,N,N,Y,N,N,N,N,Y,N,N
01206,Technovator International Ltd.,Y,N,Y,N,N,N,N,N,N,N,Y,Y,Y,N,Y,Y,N,N,Y,N,N,N,N,N,N,N
01207,SRE Group Ltd.,Y,N,Y,Y,N,N,Y,N,N,Y,Y,Y,Y,N,Y,Y,N,Y,Y,N,N,N,N,N,N,N
01208,MMG Ltd.,N,N,Y,Y,N,N,Y,N,N,N,Y,Y,Y,N,Y,Y,N,N,Y,N,Y,N,N,N,N,N
01210,Christine International Holdings Ltd.,N,N,Y,N,N,N,N,N,N,N,Y,Y,Y,N,N,N,N,N,Y,N,N,N,N,N,N,N
01211,BYD Co. Ltd. - H Shares,N,N,Y,Y,N,N,Y,N,N,N,Y,Y,Y,N,N,Y,N,Y,Y,N,N,N,N,Y,N,N
01212,Lifestyle International Holdings Ltd.,Y,N,Y,Y,N,N,Y,N,N,Y,Y,Y,Y,N,N,Y,N,N,Y,N,N,N,N,N,N,N
01213,Mobicon Group Ltd.,N,N,Y,N,N,N,N,N,N,N,N,Y,Y,N,N,N,N,N,Y,N,N,N,N,Y,N,N
01215,Kai Yuan Holdings Ltd.,Y,N,Y,Y,N,N,N,N,N,N,Y,Y,Y,N,N,Y,N,N,Y,N,N,N,N,N,N,N
01217,China Innovation Investment Ltd.,Y,N,Y,N,N,N,Y,N,N,N,Y,Y,Y,N,N,Y,N,Y,Y,N,N,N,N,Y,N,N
01218,Easyknit International Holdings Ltd.,N,N,Y,Y,N,N,N,N,N,Y,Y,Y,N,N,Y,N,N,Y,Y,N,N,N,N,N,N,N
01219,Tenwow International Holdings Ltd.,Y,N,Y,N,N,N,N,N,N,N,N,Y,N,N,Y,N,N,N,Y,N,N,N,N,N,N,Y
01220,Zhidao International (Holdings) Ltd.,Y,N,Y,N,N,N,Y,N,N,N,Y,Y,Y,N,N,Y,N,Y,Y,N,N,N,N,Y,N,N
01221,Sino Hotels (Holdings) Ltd.,N,N,N,N,N,N,N,N,N,N,N,Y,Y,N,N,N,N,Y,N,N,N,N,N,N,N,N
01222,Wang On Group Ltd.,Y,N,Y,Y,N,N,N,N,N,N,Y,Y,N,N,Y,Y,N,Y,Y,N,N,Y,N,N,N,N
01223,Symphony Holdings Ltd.,Y,N,Y,Y,N,N,Y,N,N,Y,Y,Y,Y,N,N,Y,N,Y,Y,N,N,N,N,Y,N,N
01224,C C Land Holdings Ltd.,N,N,N,N,N,N,N,N,N,N,Y,Y,N,N,N,N,N,N,Y,N,N,N,N,N,N,N
01225,Lerado Financial Group Co. Ltd.,Y,N,Y,Y,N,N,Y,N,N,Y,Y,Y,Y,N,Y,Y,N,Y,Y,N,N,Y,N,N,N,N
01226,China Investment and Finance Group Ltd.,Y,N,Y,N,N,N,N,N,Y,N,Y,Y,Y,N,Y,N,N,Y,N,N,N,N,N,Y,N,N
01227,National Investments Fund Ltd.,Y,N,Y,N,N,N,N,N,N,N,Y,Y,Y,N,N,N,N,Y,Y,N,N,N,N,Y,N,N
01228,Superb Summit International Group Ltd.,Y,Y,Y,N,N,N,Y,N,N,N,Y,Y,Y,N,N,N,N,Y,Y,N,N,N,N,Y,N,N
01229,Nan Nan Resources Enterprise Ltd.,N,N,Y,Y,N,N,N,N,N,N,Y,Y,Y,N,Y,N,N,N,N,N,N,N,N,Y,N,N
01230,Yashili International Holdings Ltd.,Y,Y,Y,N,N,N,Y,N,N,N,Y,Y,Y,N,N,Y,N,N,Y,N,N,N,N,N,N,N
01231,Newton Resources Ltd.,Y,N,Y,N,N,N,Y,N,N,N,Y,Y,Y,N,N,Y,N,N,N,N,N,N,N,N,N,N
01232,Golden Wheel Tiandi Holdings Co. Ltd.,Y,N,Y,Y,N,N,N,N,N,Y,Y,Y,Y,N,N,N,N,N,Y,N,N,N,N,N,N,N
01233,Times Property Holdings Ltd.,Y,N,Y,Y,N,N,N,N,N,N,Y,Y,Y,N,N,N,N,Y,Y,N,N,N,N,N,N,Y
01234,China Lilang Ltd.,Y,N,Y,N,N,N,N,N,N,N,N,Y,Y,N,N,N,N,N,Y,N,N,N,N,N,N,N
01235,Travel Expert (Asia) Enterprises Ltd.,N,N,Y,N,N,N,N,N,N,N,N,Y,N,N,N,N,N,N,Y,N,N,N,N,N,N,N
01236,National Agricultural Holdings Ltd.,Y,N,Y,Y,N,N,N,N,Y,Y,Y,Y,Y,N,Y,Y,N,Y,Y,N,N,N,Y,Y,N,N
01237,China Environmental Technology and Bioenergy Holdings Ltd.,Y,N,Y,N,N,N,Y,N,N,N,Y,Y,Y,N,N,Y,N,Y,Y,N,N,N,N,Y,N,N
01238,Powerlong Real Estate Holdings Ltd.,N,N,Y,Y,N,N,N,N,N,N,Y,Y,Y,N,Y,N,N,Y,Y,N,Y,N,N,N,N,N
01239,Jin Bao Bao Holdings Ltd.,Y,N,Y,N,N,N,Y,N,N,N,Y,Y,Y,N,Y,Y,N,Y,Y,N,N,N,N,Y,N,N
01240,CNQC International Holdings Ltd.,Y,N,Y,N,N,N,Y,N,N,N,Y,Y,Y,N,Y,Y,Y,Y,Y,N,N,Y,N,Y,N,N
01241,Shuanghua Holdings Ltd.,N,Y,Y,N,N,N,N,N,N,N,Y,Y,Y,N,N,N,N,N,Y,N,N,N,N,Y,N,N
01243,Wang On Properties Ltd.,Y,N,N,N,N,N,N,N,N,N,Y,Y,N,N,N,N,N,N,Y,N,N,N,N,N,N,Y
01245,"Niraku GC Holdings, Inc.",N,N,N,N,N,N,N,N,N,N,Y,Y,Y,N,N,N,N,N,Y,N,N,N,N,N,N,Y
01246,Ngai Shun Holdings Ltd.,Y,Y,Y,N,N,N,Y,N,N,N,Y,Y,Y,N,Y,Y,N,Y,Y,Y,N,N,N,Y,N,Y
01247,Miko International Holdings Ltd.,Y,Y,Y,N,N,N,Y,N,N,N,Y,Y,Y,N,Y,Y,N,N,Y,N,N,Y,N,N,N,Y
01249,Tonly Electronics Holdings Ltd.,Y,N,Y,N,N,N,N,N,N,N,Y,Y,N,N,Y,N,N,Y,Y,N,N,N,N,N,N,N
01250,Beijing Enterprises Clean Energy Group Ltd.,Y,Y,Y,Y,N,N,Y,N,N,N,Y,Y,Y,N,N,Y,N,Y,Y,Y,N,N,N,Y,N,N
01251,SPT Energy Group Inc.,Y,N,Y,Y,N,N,N,N,N,N,Y,Y,N,N,N,N,N,N,Y,N,N,N,N,N,N,N
01252,China Tianrui Group Cement Co. Ltd.,Y,N,Y,Y,N,N,Y,N,N,N,Y,Y,N,N,N,Y,N,N,Y,N,N,N,N,N,N,N
01253,Broad Greenstate International Co. Ltd.,Y,N,Y,Y,N,N,Y,N,N,N,N,Y,N,N,N,Y,N,Y,Y,N,N,N,Y,Y,N,Y
01255,S. Culture International Holdings Ltd.,N,N,Y,N,N,N,N,N,N,N,Y,Y,N,N,N,N,N,N,Y,N,N,N,N,N,N,N
01258,China Nonferrous Mining Corporation Ltd.,N,N,Y,N,N,N,N,N,N,N,Y,Y,Y,N,N,N,N,N,Y,N,N,N,N,N,N,N
01259,China Child Care Corporation Ltd.,Y,N,Y,N,N,N,Y,N,N,N,Y,Y,N,N,N,Y,N,Y,Y,N,N,N,N,Y,N,N
01260,Wonderful Sky Financial Group Holdings Ltd.,N,N,Y,N,N,N,N,N,N,N,N,Y,Y,N,N,N,N,N,Y,N,N,N,N,N,N,N
01262,Labixiaoxin Snacks Group Ltd.,N,Y,Y,N,N,N,Y,N,N,Y,Y,Y,N,N,N,Y,N,N,N,N,N,N,N,Y,N,N
01263,PC Partner Group Ltd.,N,N,N,N,N,N,N,N,Y,N,Y,Y,N,N,N,N,N,N,N,N,N,N,N,N,N,N
01265,Tianjin Jinran Public Utilities Co. Ltd. - H Shares,N,N,Y,N,N,N,N,N,N,N,Y,Y,Y,N,Y,N,N,N,Y,N,N,N,N,N,N,N
01266,Xiwang Special Steel Co. Ltd.,Y,N,Y,Y,N,N,Y,N,N,N,Y,Y,Y,N,N,Y,N,Y,Y,Y,N,N,N,N,N,N
01268,China MeiDong Auto Holdings Ltd.,Y,N,Y,Y,N,N,N,N,N,Y,N,Y,N,N,N,N,N,Y,Y,N,N,N,N,N,N,Y
01269,China First Capital Group Ltd.,Y,N,Y,Y,N,N,Y,N,N,Y,Y,Y,Y,N,Y,Y,N,N,Y,N,N,N,N,N,N,N
01270,Langham Hospitality Inv and Langham Hospitality Inv Ltd. -SS,Y,N,Y,N,N,N,N,N,N,N,N,Y,N,N,N,N,N,N,Y,N,N,N,N,N,N,N
01271,Grand Ming Group Holdings Ltd.,Y,N,Y,N,N,N,N,N,N,N,N,Y,N,N,N,N,N,Y,Y,N,N,N,N,Y,N,Y
01273,Hong Kong Finance Group Ltd.,Y,N,Y,Y,N,N,N,N,N,Y,N,Y,N,N,N,N,N,N,Y,N,N,N,N,N,N,Y
01277,Kinetic Mines and Energy Ltd.,N,Y,Y,N,N,N,N,N,N,N,Y,Y,Y,N,N,N,N,N,Y,N,N,N,N,N,N,N
01278,China New Town Development Co. Ltd.,Y,Y,Y,Y,N,N,Y,N,N,Y,Y,Y,Y,N,Y,Y,N,Y,Y,N,Y,N,N,N,N,N
01280,"Huiyin Smart Community Co., Ltd.",Y,N,Y,Y,N,N,Y,N,N,Y,Y,Y,Y,N,Y,Y,N,Y,Y,N,N,N,N,Y,N,N
01281,LongiTech Smart Energy Holding Ltd.,N,N,Y,N,N,N,N,N,N,N,Y,Y,N,N,Y,Y,N,N,Y,N,N,N,N,Y,N,N
01282,China Goldjoy Group Ltd.,Y,N,Y,N,N,N,Y,N,N,Y,Y,Y,N,N,Y,Y,N,Y,Y,N,N,N,N,Y,N,N
01285,Jiashili Group Ltd.,Y,N,N,Y,N,N,N,N,N,N,N,Y,Y,N,N,N,N,N,N,N,N,N,N,N,N,Y
01288,Agricultural Bank of China Ltd. - H Shares,Y,Y,Y,Y,N,N,N,N,N,N,N,Y,Y,N,N,N,N,Y,Y,N,Y,N,N,N,N,N
01289,Wuxi Sunlit Science and Technology Co. Ltd. - H Shares,N,N,Y,N,N,N,Y,N,N,N,Y,Y,N,N,N,Y,N,N,Y,N,N,N,N,N,N,Y
01290,China Huirong Financial Holdings Ltd.,Y,N,Y,N,N,N,N,N,N,N,N,Y,Y,N,N,N,N,N,Y,N,N,N,N,Y,N,Y
01292,"Changan Minsheng APLL Logistics Co., Ltd. - H Shares",Y,Y,Y,N,N,N,N,N,N,N,Y,Y,Y,N,N,N,N,N,Y,N,N,N,N,N,N,N
01293,Baoxin Auto Group Ltd.,Y,N,Y,N,N,N,N,N,N,N,Y,Y,Y,N,N,Y,N,Y,Y,N,N,N,N,N,N,N
01296,Guodian Technology & Environment Group Corporation Ltd.-H Sh,N,N,Y,Y,N,N,N,N,N,Y,Y,Y,Y,N,N,N,N,N,Y,N,N,N,N,N,N,N
01297,Sinosoft Technology Group Ltd.,N,N,Y,N,N,N,N,N,N,Y,N,Y,N,N,Y,N,N,Y,N,N,N,N,N,N,N,N
01298,Techcomp (Holdings) Ltd.,N,Y,Y,N,N,N,N,N,N,N,N,Y,Y,N,N,N,N,N,Y,N,Y,N,N,N,N,N
01299,AIA Group Ltd.,Y,N,Y,Y,N,N,N,N,N,N,N,Y,Y,N,N,N,N,Y,N,N,N,N,N,N,N,N
01300,Trigiant Group Ltd.,Y,N,Y,N,N,N,N,N,N,N,Y,Y,N,N,N,N,N,N,N,N,N,N,Y,Y,N,N
01301,D&G; Technology Holding Co. Ltd.,Y,Y,N,N,N,N,Y,N,N,N,Y,Y,N,N,N,N,N,N,Y,N,N,N,N,N,N,Y
01302,LifeTech Scientific Corporation,Y,N,Y,Y,N,N,N,N,N,N,Y,Y,Y,N,N,N,N,Y,Y,N,N,N,N,N,N,N
01303,Huili Resources (Group) Ltd.,Y,N,Y,Y,N,N,Y,N,N,N,Y,Y,Y,N,N,Y,N,Y,Y,N,N,N,N,N,N,N
01305,Wai Chi Holdings Co. Ltd.,Y,N,Y,Y,N,N,N,N,N,N,Y,Y,N,N,N,N,N,N,Y,N,N,N,N,N,N,Y
01308,SITC International Holdings Co. Ltd.,N,N,Y,N,N,N,N,N,N,N,N,Y,N,N,Y,N,N,N,Y,N,N,Y,N,Y,N,N
01310,HKBN Ltd.,Y,N,N,N,N,N,N,N,N,N,N,Y,Y,N,N,N,N,N,Y,N,N,N,N,Y,N,Y
01312,Allied Cement Holdings Ltd.,N,N,Y,N,N,N,N,N,N,Y,Y,Y,Y,N,Y,Y,N,Y,Y,N,N,N,N,N,N,N
01313,China Resources Cement Holdings Ltd.,N,N,Y,Y,N,N,N,N,N,Y,Y,Y,Y,N,N,N,N,Y,Y,N,N,N,N,N,N,N
01314,Tsui Wah Holdings Ltd.,N,N,Y,N,N,N,Y,N,N,N,Y,Y,N,N,N,Y,N,N,Y,N,N,N,N,N,N,N
01315,Vision Fame International Holding Ltd.,Y,Y,Y,Y,N,N,N,N,N,N,Y,Y,N,N,N,N,N,Y,Y,N,N,N,N,Y,N,N
01316,Nexteer Automotive Group Ltd.,Y,N,Y,Y,N,N,N,N,N,N,N,Y,N,N,N,N,N,N,Y,N,N,N,N,N,N,Y
01317,China Maple Leaf Educational Systems Ltd.,Y,N,Y,N,N,N,N,N,N,N,N,Y,Y,N,N,N,N,Y,Y,N,N,N,N,Y,N,Y
01318,Greens Holdings Ltd.,N,N,Y,Y,Y,N,Y,N,Y,N,Y,Y,Y,N,Y,Y,N,N,Y,N,N,N,N,Y,N,N
01319,Oi Wah Pawnshop Credit Holdings Ltd.,Y,N,Y,Y,N,N,N,N,N,Y,N,Y,N,N,N,N,N,Y,Y,N,N,Y,N,N,N,N
01321,China New City Commercial Development Ltd.,Y,N,Y,N,N,N,N,N,N,N,Y,Y,Y,N,N,N,N,N,Y,N,N,N,N,Y,N,Y
01322,CW Group Holdings Ltd.,Y,N,Y,Y,N,N,N,N,N,N,N,Y,N,N,N,N,N,N,Y,N,N,N,N,Y,N,N
01323,Newtree Group Holdings Ltd.,Y,N,Y,Y,N,N,N,N,N,Y,Y,Y,Y,N,N,N,N,Y,Y,N,N,N,N,Y,N,Y
01326,Pegasus Entertainment Holdings Ltd.,Y,N,N,N,N,Y,Y,N,N,N,Y,Y,N,N,N,Y,N,Y,Y,N,N,N,N,Y,N,N
01327,Time2U International Holding Ltd.,Y,N,Y,N,N,N,N,N,N,N,Y,Y,Y,N,Y,N,N,Y,Y,N,N,N,N,N,N,Y
01328,International Elite Ltd.,Y,N,Y,N,N,N,Y,N,N,N,Y,Y,Y,N,N,Y,N,Y,Y,N,N,N,N,Y,N,N
01329,Beijing Capital Juda Ltd.,N,Y,Y,Y,N,N,Y,N,N,N,Y,Y,N,N,Y,Y,Y,Y,Y,N,N,N,N,Y,N,N
01330,"Dynagreen Environmental Protection Group Co., Ltd. - H Share",N,N,Y,N,N,N,N,N,N,N,N,Y,Y,N,N,N,N,N,Y,N,Y,N,N,N,N,Y
01332,China Opto Holdings Ltd.,Y,N,Y,N,N,N,Y,N,N,N,Y,Y,Y,N,N,Y,N,Y,Y,N,N,N,Y,Y,N,N
01333,China Zhongwang Holdings Ltd.,Y,N,N,Y,N,N,N,N,N,N,Y,Y,Y,N,Y,Y,N,Y,Y,N,N,N,N,N,N,N
01335,Sheen Tai Holdings Group Co. Ltd.,Y,N,Y,Y,N,N,Y,N,N,N,Y,Y,Y,N,Y,Y,N,Y,Y,N,N,N,N,N,N,N
01336,New China Life Insurance Co. Ltd. - H Shares,N,Y,Y,Y,N,N,N,Y,N,N,Y,Y,Y,N,Y,Y,N,N,Y,N,N,Y,N,N,N,N
01338,BaWang International (Group) Holding Ltd.,N,N,Y,N,N,N,N,N,Y,N,Y,Y,Y,N,N,N,N,N,Y,N,N,N,N,N,N,N
01339,The People's Insurance Co. (Group) of China Ltd. - H Shares,N,N,Y,Y,N,N,N,Y,N,N,N,Y,Y,N,N,N,N,Y,Y,N,N,N,N,N,N,N
01340,Huisheng International Holdings Ltd.,Y,N,Y,N,N,N,Y,N,N,N,Y,Y,N,N,N,Y,N,Y,Y,N,N,N,N,N,N,Y
01341,Clear Lift Holdings Ltd.,Y,Y,Y,N,N,N,N,N,N,N,Y,Y,N,N,N,N,N,N,Y,N,N,N,N,N,N,Y
01345,China Pioneer Pharma Holdings Ltd.,Y,N,Y,Y,N,N,N,N,N,Y,Y,Y,N,N,Y,N,N,N,Y,N,N,N,N,Y,N,Y
01347,Hua Hong Semiconductor Ltd.,N,N,Y,N,N,N,N,N,N,N,N,Y,Y,N,N,N,N,N,Y,N,N,N,N,N,N,Y
01348,Quali-Smart Holdings Ltd.,Y,N,Y,Y,N,N,Y,N,N,N,Y,Y,N,N,N,Y,N,N,Y,N,N,N,N,Y,N,N
01349,Shanghai Fudan-Zhangjiang Bio-Pharmaceutical Co. Ltd. -H Shs,Y,N,Y,N,N,N,N,N,N,N,N,Y,Y,N,Y,N,N,N,Y,N,N,N,N,N,N,N
